{"schema_version":"1","analysis_rev":"fx-0001","producer_commit":"w0-fixture","input_artifact_hashes":{},"forklifts":[{"entity_id":"F1","source":"gt","track":[{"t_ms":0,"x":5.0,"y":-2.5,"heading":3.1416,"speed":0.8,"footprint":[[3.8,-3.1],[3.8,-1.9],[6.2,-1.9],[6.2,-3.1]],"sigma_m":0.15,"source":"gt"},{"t_ms":100,"x":4.92,"y":-2.5,"heading":3.1416,"speed":0.8,"footprint":[[3.72,-3.1],[3.72,-1.9],[6.12,-1.9],[6.12,-3.1]],"sigma_m":0.15,"source":"gt"},{"t_ms":200,"x":4.84,"y":-2.5,"heading":3.1416,"speed":0.8,"footprint":[[3.64,-3.1],[3.64,-1.9],[6.04,-1.9],[6.04,-3.1]],"sigma_m":0.15,"source":"gt"},{"t_ms":300,"x":4.76,"y":-2.5,"heading":3.1416,"speed":0.8,"footprint":[[3.56,-3.1],[3.56,-1.9],[5.96,-1.9],[5.96,-3.1]],"sigma_m":0.15,"source":"gt"},{"t_ms":400,"x":4.68,"y":-2.5,"heading":3.1416,"speed":0.8,"footprint":[[3.48,-3.1],[3.48,-1.9],[5.88,-1.9],[5.88,-3.1]],"sigma_m":0.15,"source":"gt"},{"t_ms":500,"x":4.6,"y":-2.5,"heading":3.1416,"speed":0.8,"footprint":[[3.4,-3.1],[3.4,-1.9],[5.8,-1.9],[5.8,-3.1]],"sigma_m":0.15,"source":"gt"},{"t_ms":600,"x":4.52,"y":-2.5,"heading":3.1416,"speed":0.8,"footprint":[[3.32,-3.1],[3.32,-1.9],[5.72,-1.9],[5.72,-3.1]],"sigma_m":0.15,"source":"gt"},{"t_ms":700,"x":4.44,"y":-2.5,"heading":3.1416,"speed":0.8,"footprint":[[3.24,-3.1],[3.24,-1.9],[5.64,-1.9],[5.64,-3.1]],"sigma_m":0.15,"source":"gt"},{"t_ms":800,"x":4.36,"y":-2.5,"heading":3.1416,"speed":0.8,"footprint":[[3.16,-3.1],[3.16,-1.9],[5.56,-1.9],[5.56,-3.1]],"sigma_m":0.15,"source":"gt"},{"t_ms":900,"x":4.28,"y":-2.5,"heading":3.1416,"speed":0.8,"footprint":[[3.08,-3.1],[3.08,-1.9],[5.48,-1.9],[5.48,-3.1]],"sigma_m":0.15,"source":"gt"},{"t_ms":1000,"x":4.2,"y":-2.5,"heading":3.1416,"speed":0.8,"footprint":[[3.0,-3.1],[3.0,-1.9],[5.4,-1.9],[5.4,-3.1]],"sigma_m":0.15,"source":"gt"},{"t_ms":1100,"x":4.12,"y":-2.5,"heading":3.1416,"speed":0.8,"footprint":[[2.92,-3.1],[2.92,-1.9],[5.32,-1.9],[5.32,-3.1]],"sigma_m":0.15,"source":"gt"},{"t_ms":1200,"x":4.04,"y":-2.5,"heading":3.1416,"speed":0.8,"footprint":[[2.84,-3.1],[2.84,-1.9],[5.24,-1.9],[5.24,-3.1]],"sigma_m":0.15,"source":"gt"},{"t_ms":1300,"x":3.96,"y":-2.5,"heading":3.1416,"speed":0.8,"footprint":[[2.76,-3.1],[2.76,-1.9],[5.16,-1.9],[5.16,-3.1]],"sigma_m":0.15,"source":"gt"},{"t_ms":1400,"x":3.88,"y":-2.5,"heading":3.1416,"speed":0.8,"footprint":[[2.68,-3.1],[2.68,-1.9],[5.08,-1.9],[5.08,-3.1]],"sigma_m":0.15,"source":"gt"},{"t_ms":1500,"x":3.8,"y":-2.5,"heading":3.1416,"speed":0.8,"footprint":[[2.6,-3.1],[2.6,-1.9],[5.0,-1.9],[5.0,-3.1]],"sigma_m":0.15,"source":"gt"},{"t_ms":1600,"x":3.72,"y":-2.5,"heading":3.1416,"speed":0.8,"footprint":[[2.52,-3.1],[2.52,-1.9],[4.92,-1.9],[4.92,-3.1]],"sigma_m":0.15,"source":"gt"},{"t_ms":1700,"x":3.64,"y":-2.5,"heading":3.1416,"speed":0.8,"footprint":[[2.44,-3.1],[2.44,-1.9],[4.84,-1.9],[4.84,-3.1]],"sigma_m":0.15,"source":"gt"},{"t_ms":1800,"x":3.56,"y":-2.5,"heading":3.1416,"speed":0.8,"footprint":[[2.36,-3.1],[2.36,-1.9],[4.76,-1.9],[4.76,-3.1]],"sigma_m":0.15,"source":"gt"},{"t_ms":1900,"x":3.48,"y":-2.5,"heading":3.1416,"speed":0.8,"footprint":[[2.28,-3.1],[2.28,-1.9],[4.68,-1.9],[4.68,-3.1]],"sigma_m":0.15,"source":"gt"},{"t_ms":2000,"x":3.4,"y":-2.5,"heading":3.1416,"speed":0.8,"footprint":[[2.2,-3.1],[2.2,-1.9],[4.6,-1.9],[4.6,-3.1]],"sigma_m":0.15,"source":"gt"},{"t_ms":2100,"x":3.32,"y":-2.5,"heading":3.1416,"speed":0.8,"footprint":[[2.12,-3.1],[2.12,-1.9],[4.52,-1.9],[4.52,-3.1]],"sigma_m":0.15,"source":"gt"},{"t_ms":2200,"x":3.24,"y":-2.5,"heading":3.1416,"speed":0.8,"footprint":[[2.04,-3.1],[2.04,-1.9],[4.44,-1.9],[4.44,-3.1]],"sigma_m":0.15,"source":"gt"},{"t_ms":2300,"x":3.16,"y":-2.5,"heading":3.1416,"speed":0.8,"footprint":[[1.96,-3.1],[1.96,-1.9],[4.36,-1.9],[4.36,-3.1]],"sigma_m":0.15,"source":"gt"},{"t_ms":2400,"x":3.08,"y":-2.5,"heading":3.1416,"speed":0.8,"footprint":[[1.88,-3.1],[1.88,-1.9],[4.28,-1.9],[4.28,-3.1]],"sigma_m":0.15,"source":"gt"},{"t_ms":2500,"x":3.0,"y":-2.5,"heading":3.1416,"speed":0.8,"footprint":[[1.8,-3.1],[1.8,-1.9],[4.2,-1.9],[4.2,-3.1]],"sigma_m":0.15,"source":"gt"},{"t_ms":2600,"x":2.92,"y":-2.5,"heading":3.1416,"speed":0.8,"footprint":[[1.72,-3.1],[1.72,-1.9],[4.12,-1.9],[4.12,-3.1]],"sigma_m":0.15,"source":"gt"},{"t_ms":2700,"x":2.84,"y":-2.5,"heading":3.1416,"speed":0.8,"footprint":[[1.64,-3.1],[1.64,-1.9],[4.04,-1.9],[4.04,-3.1]],"sigma_m":0.15,"source":"gt"},{"t_ms":2800,"x":2.76,"y":-2.5,"heading":3.1416,"speed":0.8,"footprint":[[1.56,-3.1],[1.56,-1.9],[3.96,-1.9],[3.96,-3.1]],"sigma_m":0.15,"source":"gt"},{"t_ms":2900,"x":2.68,"y":-2.5,"heading":3.1416,"speed":0.8,"footprint":[[1.48,-3.1],[1.48,-1.9],[3.88,-1.9],[3.88,-3.1]],"sigma_m":0.15,"source":"gt"},{"t_ms":3000,"x":2.6,"y":-2.5,"heading":3.1416,"speed":0.8,"footprint":[[1.4,-3.1],[1.4,-1.9],[3.8,-1.9],[3.8,-3.1]],"sigma_m":0.15,"source":"gt"},{"t_ms":3100,"x":2.52,"y":-2.5,"heading":3.1416,"speed":0.8,"footprint":[[1.32,-3.1],[1.32,-1.9],[3.72,-1.9],[3.72,-3.1]],"sigma_m":0.15,"source":"gt"},{"t_ms":3200,"x":2.44,"y":-2.5,"heading":3.1416,"speed":0.8,"footprint":[[1.24,-3.1],[1.24,-1.9],[3.64,-1.9],[3.64,-3.1]],"sigma_m":0.15,"source":"gt"},{"t_ms":3300,"x":2.36,"y":-2.5,"heading":3.1416,"speed":0.8,"footprint":[[1.16,-3.1],[1.16,-1.9],[3.56,-1.9],[3.56,-3.1]],"sigma_m":0.15,"source":"gt"},{"t_ms":3400,"x":2.28,"y":-2.5,"heading":3.1416,"speed":0.8,"footprint":[[1.08,-3.1],[1.08,-1.9],[3.48,-1.9],[3.48,-3.1]],"sigma_m":0.15,"source":"gt"},{"t_ms":3500,"x":2.2,"y":-2.5,"heading":3.1416,"speed":0.8,"footprint":[[1.0,-3.1],[1.0,-1.9],[3.4,-1.9],[3.4,-3.1]],"sigma_m":0.15,"source":"gt"},{"t_ms":3600,"x":2.12,"y":-2.5,"heading":3.1416,"speed":0.8,"footprint":[[0.92,-3.1],[0.92,-1.9],[3.32,-1.9],[3.32,-3.1]],"sigma_m":0.15,"source":"gt"},{"t_ms":3700,"x":2.04,"y":-2.5,"heading":3.1416,"speed":0.8,"footprint":[[0.84,-3.1],[0.84,-1.9],[3.24,-1.9],[3.24,-3.1]],"sigma_m":0.15,"source":"gt"},{"t_ms":3800,"x":1.96,"y":-2.5,"heading":3.1416,"speed":0.8,"footprint":[[0.76,-3.1],[0.76,-1.9],[3.16,-1.9],[3.16,-3.1]],"sigma_m":0.15,"source":"gt"},{"t_ms":3900,"x":1.88,"y":-2.5,"heading":3.1416,"speed":0.8,"footprint":[[0.68,-3.1],[0.68,-1.9],[3.08,-1.9],[3.08,-3.1]],"sigma_m":0.15,"source":"gt"},{"t_ms":4000,"x":1.8,"y":-2.5,"heading":3.1416,"speed":0.8,"footprint":[[0.6,-3.1],[0.6,-1.9],[3.0,-1.9],[3.0,-3.1]],"sigma_m":0.15,"source":"gt"},{"t_ms":4100,"x":1.72,"y":-2.5,"heading":3.1416,"speed":0.8,"footprint":[[0.52,-3.1],[0.52,-1.9],[2.92,-1.9],[2.92,-3.1]],"sigma_m":0.15,"source":"gt"},{"t_ms":4200,"x":1.64,"y":-2.5,"heading":3.1416,"speed":0.8,"footprint":[[0.44,-3.1],[0.44,-1.9],[2.84,-1.9],[2.84,-3.1]],"sigma_m":0.15,"source":"gt"},{"t_ms":4300,"x":1.56,"y":-2.5,"heading":3.1416,"speed":0.8,"footprint":[[0.36,-3.1],[0.36,-1.9],[2.76,-1.9],[2.76,-3.1]],"sigma_m":0.15,"source":"gt"},{"t_ms":4400,"x":1.48,"y":-2.5,"heading":3.1416,"speed":0.8,"footprint":[[0.28,-3.1],[0.28,-1.9],[2.68,-1.9],[2.68,-3.1]],"sigma_m":0.15,"source":"gt"},{"t_ms":4500,"x":1.4,"y":-2.5,"heading":3.1416,"speed":0.8,"footprint":[[0.2,-3.1],[0.2,-1.9],[2.6,-1.9],[2.6,-3.1]],"sigma_m":0.15,"source":"gt"},{"t_ms":4600,"x":1.32,"y":-2.5,"heading":3.1416,"speed":0.8,"footprint":[[0.12,-3.1],[0.12,-1.9],[2.52,-1.9],[2.52,-3.1]],"sigma_m":0.15,"source":"gt"},{"t_ms":4700,"x":1.24,"y":-2.5,"heading":3.1416,"speed":0.8,"footprint":[[0.04,-3.1],[0.04,-1.9],[2.44,-1.9],[2.44,-3.1]],"sigma_m":0.15,"source":"gt"},{"t_ms":4800,"x":1.16,"y":-2.5,"heading":3.1416,"speed":0.8,"footprint":[[-0.04,-3.1],[-0.04,-1.9],[2.36,-1.9],[2.36,-3.1]],"sigma_m":0.15,"source":"gt"},{"t_ms":4900,"x":1.08,"y":-2.5,"heading":3.1416,"speed":0.8,"footprint":[[-0.12,-3.1],[-0.12,-1.9],[2.28,-1.9],[2.28,-3.1]],"sigma_m":0.15,"source":"gt"},{"t_ms":5000,"x":1.0,"y":-2.5,"heading":3.1416,"speed":0.8,"footprint":[[-0.2,-3.1],[-0.2,-1.9],[2.2,-1.9],[2.2,-3.1]],"sigma_m":0.15,"source":"gt"},{"t_ms":5100,"x":0.92,"y":-2.5,"heading":3.1416,"speed":0.8,"footprint":[[-0.28,-3.1],[-0.28,-1.9],[2.12,-1.9],[2.12,-3.1]],"sigma_m":0.15,"source":"gt"},{"t_ms":5200,"x":0.84,"y":-2.5,"heading":3.1416,"speed":0.8,"footprint":[[-0.36,-3.1],[-0.36,-1.9],[2.04,-1.9],[2.04,-3.1]],"sigma_m":0.15,"source":"gt"},{"t_ms":5300,"x":0.76,"y":-2.5,"heading":3.1416,"speed":0.8,"footprint":[[-0.44,-3.1],[-0.44,-1.9],[1.96,-1.9],[1.96,-3.1]],"sigma_m":0.15,"source":"gt"},{"t_ms":5400,"x":0.68,"y":-2.5,"heading":3.1416,"speed":0.8,"footprint":[[-0.52,-3.1],[-0.52,-1.9],[1.88,-1.9],[1.88,-3.1]],"sigma_m":0.15,"source":"gt"},{"t_ms":5500,"x":0.6,"y":-2.5,"heading":3.1416,"speed":0.8,"footprint":[[-0.6,-3.1],[-0.6,-1.9],[1.8,-1.9],[1.8,-3.1]],"sigma_m":0.15,"source":"gt"},{"t_ms":5600,"x":0.52,"y":-2.5,"heading":3.1416,"speed":0.8,"footprint":[[-0.68,-3.1],[-0.68,-1.9],[1.72,-1.9],[1.72,-3.1]],"sigma_m":0.15,"source":"gt"},{"t_ms":5700,"x":0.44,"y":-2.5,"heading":3.1416,"speed":0.8,"footprint":[[-0.76,-3.1],[-0.76,-1.9],[1.64,-1.9],[1.64,-3.1]],"sigma_m":0.15,"source":"gt"},{"t_ms":5800,"x":0.36,"y":-2.5,"heading":3.1416,"speed":0.8,"footprint":[[-0.84,-3.1],[-0.84,-1.9],[1.56,-1.9],[1.56,-3.1]],"sigma_m":0.15,"source":"gt"},{"t_ms":5900,"x":0.28,"y":-2.5,"heading":3.1416,"speed":0.8,"footprint":[[-0.92,-3.1],[-0.92,-1.9],[1.48,-1.9],[1.48,-3.1]],"sigma_m":0.15,"source":"gt"},{"t_ms":6000,"x":0.2,"y":-2.5,"heading":3.1416,"speed":0.8,"footprint":[[-1.0,-3.1],[-1.0,-1.9],[1.4,-1.9],[1.4,-3.1]],"sigma_m":0.15,"source":"gt"},{"t_ms":6100,"x":0.12,"y":-2.5,"heading":3.1416,"speed":0.8,"footprint":[[-1.08,-3.1],[-1.08,-1.9],[1.32,-1.9],[1.32,-3.1]],"sigma_m":0.15,"source":"gt"},{"t_ms":6200,"x":0.04,"y":-2.5,"heading":3.1416,"speed":0.8,"footprint":[[-1.16,-3.1],[-1.16,-1.9],[1.24,-1.9],[1.24,-3.1]],"sigma_m":0.15,"source":"gt"},{"t_ms":6300,"x":-0.04,"y":-2.5,"heading":3.1416,"speed":0.8,"footprint":[[-1.24,-3.1],[-1.24,-1.9],[1.16,-1.9],[1.16,-3.1]],"sigma_m":0.15,"source":"gt"},{"t_ms":6400,"x":-0.12,"y":-2.5,"heading":3.1416,"speed":0.8,"footprint":[[-1.32,-3.1],[-1.32,-1.9],[1.08,-1.9],[1.08,-3.1]],"sigma_m":0.15,"source":"gt"},{"